{
  "Arn": "arn:aws:service:us-east-1:123456789012:resource/example",
  "ChannelId": "id-abc123",
  "CreatedAt": "example-value",
  "EndTime": "example-value",
  "Id": "id-abc123",
  "OriginEndpointId": "id-abc123",
  "S3Destination": "example-value",
  "StartTime": "example-value",
  "Status": "ACTIVE"
}